kod	nazev
72483	Stroje k vyrobe, opravovani obuvi
72485	Stroje k vyrobe, opravovani vyrobku z usni, kuze ap.
72488	Dily pro stroje k uprave, cineni ap. kuze, kozek ap.
7249	Díly pro stroje k praní, čištění apod.
72491	Dily pro pracky pro domacnost, pradelny
72492	Dily pro stroje na chemicke cisteni, suseni, prani
725	Stroje pro papírny, celulózky, k řezání papíru ap.
7251	Stroje k výrobě buničiny z celulózové vlákniny
72511	Stroje k vyrobe buniciny z celulozove vlakniny
72512	Stroje k vyrobe nebo dokoncovani papiru nebo lepenky
7252	Ost. stroje k výrobě buničiny, papíru nebo lepenky
72521	Rezacky
72523	Stroje k vyrobe pytlu, sacku, obalek
72525	Stroje k vyrobe kartonu, krabic, beden, trubic, bubnu
72527	Stroje k tvarovani vyrobku z buniciny, papiru ap.
72529	Ostatni stroje k vyrobe buniciny, papiru, lepenky
7259	Díly ke strojům pro papírny a celulózky
72591	Dily stroju k vyrobe buniciny z celulozove vlakniny
72599	Dily ost. stroju k vyrobe buniciny, papiru, lepenky
726	Stroje tiskařské a knihařské a jejich díly
7263	Stroje pro lití, sázeni, zhotovování forem, štočků
72631	Stroje, zarizeni pro liti, sazeni aj. forem, stocku
72635	Tiskarska sazba, formy, stocky, valce aj. komponenty
7265	Stroje pro ofsetový tisk
72651	Navijeni roli (u stroju pro ofsetovy tisk)
72655	Podavace archu kancelarskeho typu
72659	Ostatni stroje pro ofsetovy tisk
7266	Ostatní tiskařské stroje
72661	Knihtiskarske stroje (ne flexograficky tisk)
72663	Stroje pro flexograficky tisk
72665	Stroje pro hlubotisk
72669	Ostatní tiskařské stroje, j.n.
7268	Knihvazačské stroje (vč. šiček knih), díly
72681	Knihvazacske stroje (vc. sicek)
72689	Dily pro knihvazacske stroje
7269	Díly k tiskařským strojům
72691	Dily pro stroje pro liti, sazeni aj. forem, stocku
72699	Dily pro stroje ost. tiskarske a pro ofsetovy tisk
727	Stroje potravinářské (užívané jen průmyslově)
7271	Stroje pro mlynářský průmysl a ke zpracovaní obilnin
72711	Stroje uzivane v mlynarskem prumyslu
72719	Dily stroju mlynarskeho prum., na cisteni ap. obili
7272	Ostatní potravinářské stroje a jejich díly, j.n.
72721	Stroje k extrakci, uprave tuku, oleju
72722	Stroje, j.n. k priprave a vyrobe potravin ci napoju
72729	Dily potravinarskych stroju
728	Stroje, zaříz. ost. pro určitá odvětví průmyslu, díly
7281	Obráběcí stroje zvláštního provedení
72811	Obrabeci stroje k opracovani kamene, betonu, skla ap.
72812	Obrabeci stroje na drevo, korek, kosti, kaucuk apod.
72819	Dily k obrabecim strojum pro urcita prumysl. odvetvi
7282	Stroje,přístroje pro výrobu polov.destiček,součástek,el.integr.obvodů,plochých displejů;součásti
72821	Stroje,přístroje pro výrobu polov.destiček,součástek,el.integr.obvodů,plochých displejů
72822	Stroje,přístroje pro výrobu,opravu,montáž,nakládání s polov.součástkami,el.integr.obvody apod.
72829	Součásti strojů,přístrojů pro výrobu polov.destiček,součástek,el.integr.obvodů,plochých displejů
7283	Stroje k třídění, prosévání, oddělování zeminy, apod.
72831	Stroje k trideni, prosevani, prani zeminy, rud aj.
72832	Stroje k drceni zeminy, kamene, rud aj. latek
72833	Stroje k miseni, hneteni zeminy, kamene, rud aj.
72834	Stroje k aglomeraci, lisovani, tvarovani
72839	Dily stroju na trideni, prosevani ap. zeminy, rud aj.
7284	Stroje speciálně řešené pro určitá průmyslová odvětví
72841	Stroje k vyrobe elektrickych nebo elektronickych lamp
72842	Stroje ke zpracovani kaucuku nebo plastickych hmot
72843	Stroje k uprave, zpracovani tabaku, j.n.
72844	Lisy k vyrobe desek, ost. stroje na zpracovani dreva
72846	Stroje ke zpracovani kovu (vc.navijecek elektr.dratu)
72847	Stroje k izotopicke separaci a jejich dily, j.n.
72849	Stroje s individualni funkci, j.n.
7285	Díly ke strojům pro určitá průmyslová odvětví
72851	Dily stroju k vyrobe elektrickych ap. lamp, trubic aj
72852	Dily stroju k zpracovani kaucuku, plastickych hmot
72853	Dily stroju k uprave a zpracovani tabaku
72855	Dily, j.n., stroju extrakce tuku ap., zpracovani kovu
73	Kovozpracující stroje
731	Stroje kovoobráběcí třískové
7311	Obráběcí stroje k obrábění úběrem
73111	Obrabeci stroje k obrabeni laserovymi aj. paprsky
73112	Obrabeci stroje k obrabeni ultrazvukem
73113	Obrabeci stroje k obrabeni elektrickym vybojem
73114	Obrabeci stroje k obrabeni elektromech. postupem ap.
7312	Obráběcí centra, jednoúčelové a kombinované stroje
73121	Obrabeci centra
73122	Jednoucelove stroje
73123	Kombinovane postupove stroje
7313	Soustruhy k úběru kovu
73131	Horizontalni soustruhy, cislicove rizene
73135	Ostatni soustruhy, cislicove rizene
73137	Ostatni horizontalni soustruhy
73139	Soustruhy, j.n.
7314	Obráběcí stroje k vrtaní a vyvrtávání
73141	Stroje s pohyblivou (vymennou) hlavou
73142	Ostatni vrtacky, cislicove rizene
73143	Vrtacky, j.n.
73144	Ostatni vyvrtavacky-frezky, cislicove rizene
73145	Vyvrtavacky-frezky, j.n.
73146	Ostatni vyvrtavacky
7315	Obráběcí stroje k frézování, řezání závitů
73151	Konzolove frezy, cislicove rizene
73152	Ostatni konzolove frezy
73153	Ostatni frezy, cislicove rizene
73154	Frezy, j.n.
73157	Ostatni stroje k rezani zavitu, vnitrnich zavitu
7316	Kovoobráběcí stroje k odjehlování, broušeni apod.
73161	Obrabeci stroje na povrchove upravy, cislicove rizene
73162	Cislicove nerizene obrabeci stroje na povrch. upravy
73163	Ostatni brusky, cislicove rizene
73164	Brusky, j.n.
73165	Ostricky (ostreni nastroju, frez), cislicove rizene
73166	Ostatni ostricky (ostreni nastroju, frez)
73167	Honovaci, lapovaci stroje
73169	Obrabeci stroje k odjehlovani, lesteni ap. kovu aj.
7317	Kovoobráběcí stroje k hoblování, tváření, apod.
73171	Tvareci, drazkovaci stroje
73173	Protahovaci stroje
73175	Stroje k obrabeni, brouseni ap. ozubenych kol
73177	Rezacky
73179	Obrabeci stroje pracujici s ubiranim kovu ap., j.n.
733	Stroje kovoobráběcí beztřískové
7331	Obráběcí stroje beztřískové (vč.lisů)
73311	Stroje na kovani, liti pod tlakem (vc. lisu), buchary
73312	Stroje na ohybani, prekladani ap., cislicove rizene
73313	Stroje na ohybani, prekladani ap., cislicove nerizene
73314	Strihaci stroje (vc. lisu), cislicove rizene
73315	Strihaci stroje (vc. lisu), cislicove nerizene
73316	Derovaci, drazkovaci stroje, cislicove rizene
73317	Derovaci, drazkovaci stroje, j.n.
73318	Lisy ke zpracovani kovu, karbidu kovu, j.n.
7339	Jiné obráběcí stroje ke zpracování kovů, cermentů ap.
73391	Tazne stolice na tyce, trubky, profily, drat apod.
73393	Valcovacky zavitu
73395	Stroje ke zpracovani dratu
73399	Obrabeci stroje ke zpracovani kovu, cermentu ap. j.n.
735	Díly jn. a příslušenství ke strojům kovoobráběcím
7351	Pracovní držáky, samočinné závitořezné hlavy
73511	Drzaky nastroju, samocinne zavitorezne hlavy
73513	Pracovni drzaky
73515	Delici hlavy, ost. specialni pridavna zarizeni
7359	Díly,j.n. a spec. přídavná zaříz. k obráběcím strojům
73591	Dily, spec. zarizeni pro kovoobrabeci stroje triskove
73595	Dily, spec. zarizeni stroju kovoobrab. beztriskovych
737	Zaříz. strojní ke zpracování kovů (ne stroje obráběcí)
7371	Konvertory, pánve, kokily pro ingoty a licí stroje
73711	Konvertory, kokily pro ingoty, panve
73712	Lici stroje
73719	Dily konvertoru, kokil, licich stroju
7372	Válcovny kovu a válce a jejich díly
73721	Valcovny kovu
73729	Valce, ostatni dily valcoven kovu
7373	Stroje a zařízení pro pájení a sváření
73731	Pajedla, pistolova pajedla
73732	Ostatni stroje, pristroje k tvrdemu pajeni a pajeni
73733	Stroje, pristr. pro odporove svarovani kovu, automat.
73734	Ostatni stroje, pristroje pro odporove svarovani kovu
73735	Stroje, pristr. k obloukovemu svarovani kovu automat.
73736	Ost. stroje, pristroje k obloukovemu svarovani kovu
73737	Ostatni stroje, zarizeni pro pajeni a svarovani
73739	Dily stroju, pristroju pro pajeni a svarovani
7374	Stroje, přístroje pro pájení, svařování, díly, j.n.
73741	Rucni pistaly
73742	Ostatni stroje, zarizeni na pajeni, svarovani na plyn
73743	Ostatni stroje, pristroje na pajeni, svarovani, j.n.
73749	Dily pro stroje, pristroje na pajeni, svarovani
74	Stroje a zařízení všeobecně užívané v průmyslu, j.n.
741	Zařízení k ohřevu a chlazení a jejich díly jn.
7412	Pecní hořáky, mechanická zauhlovací zařízení ap. j.n.
74121	Pecni horaky na kapalna paliva
74123	Ostatni pecni horaky (vc. kombinovanych)
74125	Mechanicka zauhlovaci zarizeni, mechanicke rosty ap.
74128	Dily horaku, mechanickych zauhl. zarizeni, rostu ap.
7413	Průmyslové pece a laboratorní pícky, atd., vč. dílů
74131	Pece, picky s odporovym ohrevem
74132	Indukcni, dielektricke pece, picky
74133	Ostatni pece, picky
74134	Ostatni indukcni, dielektricka topna zarizeni
74135	Dily peci, picek s odporovym ohrevem, indukcnich aj.
74136	Pece, picky k prazeni, taveni ap. rud, pyritu, kovu
74137	Pekarske pece (vc. peci na peceni sucharu)
74138	Ostatni pece, picky (vc. spalovacich peci)
74139	Dily k pecim, pickam k prazeni ap. rud aj., pekarskym
7414	Chladničky, mrazničky apod. k průmyslovým účelům
74143	Chladici, mrazici pulty, skrine, vystavni skrine ap.
74145	Ostatni chladici, mrazici zarizeni, tepelna cerpadla
74149	Dily k chladnickam, mraznickam ap. zarizeni
7415	Klimatizační zařízení
74151	Klimatizacni zarizeni okenni, nastenna s vl. pohonem
74155	Ostatni klimatizacni zarizeni
74159	Dily ke klimatizacnim zarizenim
7417	Generátory plynu, výměníky tepla apod. zařízení
74171	Prumyslove generatory plynu, vodniho plynu apod.
74172	Dily k prumyslovym generatorum plynu, vodniho plynu
74173	Destilacni, rektifikacni zarizeni
74174	Vymeniky tepla
74175	Zarizeni ke zkapalnovani vzduchu, plynu
7418	Ost.prům. zařízení ke zprac. materialů změnou teploty
74181	Prutokove plynove ohrivace vody
74182	Ost. prutokove, zasobnikove ohrivace vody, neelektr.
74183	Lekarske, chirurgicke, laboratorni sterilizatory
74184	Susicky zemedelskych produktu
74185	Susicky na potraviny, bunicinu, papir, lepenku
74186	Susicky, j.n.
74187	Stroje na vyrobu horkych napoju, vareni ap. potravin
74189	Ost. stroje ke zpracovani materialu zmenou teploty
7419	Díly ke strojům zařazených ve skupinách 741.7 a 741.8
742	Čerpadla a dopravníky na kapaliny a jejich díly
7421	Čerpadla k vybavení měřícími přístroji
74211	Cerpadla k davkovani paliva, maziva s mericimi prist.
74219	Ostatni cerpadla s mericimi pristroji
7422	Čerpadla paliv, maziv pro pístové motory
7423	Čerpadla na beton
7424	Objemová čerpadla s vratným pohybem, j.n.
7425	Rotační objemová čerpadla, j.n.
7426	Odstředivá čerpadla, j.n.
7427	Čerpadla na kapaliny, j.n., a dopravníky kapalin
74271	Cerpadla na kapaliny, j.n.
74275	Dopravniky kapalin
7429	Díly k čerpadlům a dopravníkům kapalin
74291	Dily k cerpadlum
74295	Dily k dopravnikum kapalin
743	Čerpadla (ne na kapaliny), kompresory, ventilátory ap.
7431	Čerpadla na vzduch nebo vývěvy, kompresory vzduchu
74311	Vyvevy
74313	Cerpadla na vzduch ovladane rucne, pedalem
74315	Kompresory uzivane v chladicim zarizeni
74317	Kompresory na vzduch montovane na podvozek
74319	Ostatni kompresory, digestore
7434	Ventilace a kuchyňské digestoře
74341	Ventilatory stolni, podlahove, okenni ap. do 125 W
74343	Ostatni ventilatory
74345	Digestore s horizontalni stranou do 120 cm
7435	Odstředivky (vč. odstředivých sušiček), j.n.
74351	Odstredivky smetany
74355	Susicky odevu
74359	Ostatni odstredivky
7436	Filtrační a čistící stroje na kapaliny nebo plyny
74361	Stroje a pristroje na filtrovani, cisteni vody
74362	Stroje a pristroje na filtrovani, cisteni napoju
74363	Filtry nafty, benzinu do motoru s vnitrnim spalovanim
74364	Filtry vstupniho vzduchu do motoru s vnitrnim spalov.
74367	Filtry, cistici stroje, pristroje na kapaliny, j.n.
74369	Filtry, cistici stroje, pristroje na plyny, j.n.
7438	Díly k čerpadlům, kompresorům, ventilátorům apod.
7439	Díly k přístrojům filtračním, čistícím, odstředivkám
74391	Dily k odstredivkam (vc. odstredivych susicek)
74395	Dily k filtracnim, cisticim strojum, pristrojum
744	Zařízení manipulační mechanická a díly k nim jn.
7441	Přepravní vozíky pro továrny, sklady, přístaviště
74411	Samohybne voziky s el. motorem zvedacim ap. zarizenim
74412	Ostatni samohybne voziky se zvedacim ap. zarizenim
74413	Ostatni prepravni voziky se zvadacim ap. zarizenim
74414	Prepravni voziky elektricke samohybne bez zved. zar.
74415	Ost. samohybne prepravni voziky bez zvedaciho zariz.
74419	Dily voziku, traktoru samohybnych bez manip. zarizeni
7442	Kladkostroje a zdvihadla; vrátky a navijáky
74421	Kladkostroje, zdvihadla (ne skipove vytahy)
74425	Ostatni vratky, navijaky
7443	Deriky, jeřáby, mobilni zdvihací zařízení apod.
74431	Mostove jeraby na stabilni konstrukci
74432	Mobilni ramova zdvihaci zarizeni na pneumatikach
74433	Ostatni jeraby, mobilni ramova zdvihaci zarizeni
74434	Vezove jeraby
74435	Portalove, stojanove otocne jeraby
74437	Ostatni zdvihaci stroje s vlastnim pohonem
74439	Ostatni zdvihaci stroje bez vlastniho pohonu
7444	Zvedáky; zdvihadla ke zvedání vozidel
74441	Zabudovane zvedaci systemy do garazi
74443	Ostatni zvedaky, zdvihadla, hydraulicke
74449	Ostatni zvedaky, zdvihadla k zvedani automobilu
7447	Kontinuální výtahy a dopravní pásy
74471	Pneumaticke vytahy, dopravni pasy
74472	Ostatni kontinualni vytahy, dopravni pasy pro podzemi
74473	Ostatni kontinualni vytahy, dopravni pasy, koreckove
74474	Ost. kontinualni vytahy, dopravni pasy, pasoveho typu
74479	Kontinualni vytahy, dopravni pasy na zbozi, material
7448	Zvedací, manipulační, nakládací nebo vykládací stroje
74481	Zdvize, skipove vytahy
74485	Eskalatory, pohyblive chodniky
74489	Ostatni zvedaci, manipulacni, nakladaci apod. stroje
7449	Díly přepravních vozíků,kladkostrojů,zdvihadel, apod.
74491	Dily kladkostroju, zdvihadel, navijaku, zvedaku
74492	Dily voziku se zvedacim, manipulacnim zarizenim
74493	Dily zdvizi, skipovych vytahu, eskalatoru
74494	Dily ostatnich zvedacich, nakladacich ap. stroju
745	Zaříz. strojní neelekt. ost., nářadí, přístroje mech.
7451	Nástroje ruční pneumatické nebo s neelektr. motorem
74511	Nastroje rucni pneumaticke
74512	Nastroje rucni s neelektrickym motorem
74519	Dily nastroju rucnich pneumatickych, s neel. motorkem
7452	Strojní myčky nádobí (ne pro domácnost), myčky lahví
74521	Strojni mycky nadobi, ne pro domacnost
74523	Strojni zarizeni k cisteni, suseni lahvi aj. nadob
74527	Ostatni balici zarizeni
74529	Dily mycek nadobi, lahvi, zar. pro plneni lahvi ap.
7453	Vážící zařízení vč. počítacího aj. zařízení, závaží
74531	Vazici zarizeni vc. pocitaciho, kontrolniho zarizeni
74532	Osobni vahy (vc. kojeneckych), vahy pro domacnost
74539	Zavazi k vaham vseho druhu, dily vaziciho zarizeni
7456	Mechanické přístr. k tryskání, stříkání, rozprašování
74561	Hasici pristroje, plne, prazdne
74562	Strikaci pistole ap. pristroje
74563	Zarizeni k ofukovani parou, tryskani pisku apod.
74564	Zemedelske aj. pristroje k tryskani ap. kapalin aj.
74565	Ostatni mechanicke pristroje k rozprasovani, tryskani
74568	Dily  mech. pristroju k rozprasovani, tryskani ap.
7459	Ostatní neelektrické strojní zařízení, dily
74591	Kalandry apod. stroje s valci
74593	Valce, ostatni dily kalndru ap. stroju s valci
74595	Prodejni automaty vc. menicu minci
74597	Dily prodejnich automatu vc. menicu minci
746	Ložiska kuličková a válečková
7461	Kuličková ložiska
7462	Kuželíková ložiska (vč. sestav kuželíku)
7463	Soudečková ložiska
7464	Jehlová ložiska
7465	Ostatní válečková ložiska
7468	Ostatní kuličková, válečková ložiska
7469	Díly kuličkových, válečkových ložisek
74691	Kulicky, jehly, valecky
74699	Ostatni dily kulickovych, valeckovych lozisek
747	Kohouty, ventily aj. armatury pro potrubí, kotle ap.
7471	Redukční ventily
7472	Ventily pro oleohydraulické, pneumatické převody
7473	Zpětné ventily
7474	Bezpečnostní, pojistné ventily
7478	Kohouty, ventily apod. armatury, j.n.
7479	Díly ke kohoutům, ventilům ap. pro potrubí, kotle
748	Hřídele, kliky převodové, tělesa ložisková, spojky ap.
7481	Převodové hřídele (vč. vačkových, klikových), kliky
7482	Ložisková tělesa, pouzdra kluzných ložisek
74821	Loziskova telesa, s kulickovymi, valeckovymi lozisky
74822	Loziskova telesa bez kulickovych, valeckovych lozisek
7483	Článkové řetezy, díly, ze železa, oceli
74831	Valeckove retezy
74832	Ostatni clankove retezy
74839	Dily clankovych retezu
7484	Ozubená soukolí, převody, kuličkové šrouby apod.
7485	Setrvačníky, kladky (vč. kladkostrojů)
7486	Spojky, hřídelové spojky (vč. univerzálních spojek)
7489	Díly j.n., k převodovým hřídelím, klikám, skříním ap.
749	Díly a příslušenství strojů neelektrické jn.
7491	Formovací rámy slévárenské, formy trvalé, na kov ap.
74911	Formovaci ramy slevarenske
74912	Trvale formy
74913	Odlevaci modely
74914	Vstrikovaci, lisovaci formy na kovy, karbidy kovu
74915	Ostatni formy na kovy, karbidy kovu
74916	Formy na sklo
74917	Formy na nerostne materialy
74918	Vstrikovaci, lisovaci formy na kaucuk, plasty
74919	Ostanti formy na kaucuk, plasty
7492	Těsnění ap. spojovací materiál z plechu
7499	Strojní části bez elektrických prvků, j.n.
74991	Lodni kola, jejich lopatky
74999	Ostatni strojni casti bez elektrickych prvku
75	Kancelářské stroje a zař. k automat. zpracování dat
751	Stroje kancelářské
7511	Psací stroje jiné než pod záhlavím 726.5, 726.6 a 751.9; stroje pro zpracování textu
7512	Stroje kalkulační, účtovací, kontrolní pokladny apod.
75121	Elektronicke kalkulatory
75122	Ostatni kalkulacni stroje
75124	Registracni pokladny s kalkulacnim zarizenim
75128	Účtovací stroje,poštovní frankovací stroje,automaty vydávající jízdenky apod.
7519	Ostatní kancelářské stroje (rozmnožovací, adresovací apod.)
75191	Rozmnožovací přístroje
75193	Stroje na třídění,zakládání,otevírání pošty,zalepování obálek apod.
75194	Stroje kombinující min. 2 z funkcí tisku, kopírování , fax.přenosu, připojitelné k PC
75195	Ostatní kancelářské stroje, připojitelné k PC
75196	Ostatní tiskárny, kopírovací a faxové přístroje
75197	Díly a příslušenství ostatních strojů pro tisk
75199	Kancelářské stroje, j.n.
752	Zařízení k automat. zpracování dat, jednotky periferní
7522	Zařízení k autom.zprac.dat přenosná,<10kg,obs.min.CPU,klávesnici,displej
7523	Ostatní zařízení k autom.zprac.dat
7526	Vstupní nebo výstupní jednotky
7527	Paměťové jednotky
7528	Ostatní jednotky zařízení k autom.zprac.dat
7529	Zařízení ke zpracování dat, j.n.
759	Díly ap. ke strojům kancel. a automat. zpracování dat
7598	Díly, příslušenství vhodné současně pro 2 a více strojů podskupin 751.1, 751.2, 751.9 a skupiny 752
7599	Díly, příslušenství strojů podskupin 751.1, 751.2, 751.9 a skupiny 752
75991	Díly, příslušenství strojů podskupiny 751.1
75993	Díly, příslušenství strojů podskupiny 751.9, nikoli pro tisk
75995	Díly, příslušenství elektonických kalkulačních strojů podskupiny 751.2
75997	Díly, příslušenství strojů skupiny 752
76	Zařízení pro telekomunikace a pro záznam a reprodukci zvuku
761	Monitory a projektory; televizní přijímače, i kombinované
7613	Monitory CRT
7614	Ostatní monitory
7615	Projektory
7616	Televizní přijímače, i kombinované
762	Rozhlasové přijímače, i kombinované
7621	Rozhlasové přijímače s vnějším zdrojem energie
76211	Rozhlas. prist. s prist. zaznamu, reprod., bez zdroje
76212	Rozhlas. pris. bez pris. zaznamu, reprod., bez zdroje
7622	Rozhlasové přijímače bez vnějšího zdroje energie
76221	Rozhlas. prist. s prist. zaznamu, reprod., se zdrojem
76222	Rozhl. pr. bez pr. zaznamu, reprod. zvuku, se zdrojem
7628	Ostatní rozhlasové přijímače
76281	Ost. rozhlas. pristr. s pristr. zaznamu, reprodukce
76282	Ost. rozhlas. pristr. bez pristr. zaznamu, reprodukce
76289	Ost. rozhlas. pris. bez pris. zaznamu, reprod., hodin
763	Přístroje pro záznam, reprodukci zvuku, obrazu
7633	Přístroje pro záznam, reprodukci zvuku
76331	Přístroje pro záznam,reprodukci zvuku,spouštěné mincemi aj.platidly
76335	Gramofonová chassis
76336	Přístroje odpovídající na telefonáty (telef.záznamníky)
76339	Ostatní přístroje pro záznam, reprodukci zvuku
7638	Přístroje pro záznam, reprodukci obrazu
76381	Přístroje pro záznam, reprodukci obrazu, páskového typu
76384	Ostatní přístroje pro záznam, reprodukci obrazu
764	Zařízení telekomunikační, příslušenství přístojů pro záznam, reprodukci zvuku, obrazu
7641	Telefonní přístroje (vč.mobilních); ostatní přístroje pro vysílání, přijímání hlasu, dat
76411	Telefonní přístroje (vč.mobilních)
76412	Ostatní přístroje pro vysílání, přijímání hlasu, dat
76418	Díly,příslušenství telekomunikač.přístrojů a přístrojů pro záznam,reprodukci zvuku,obrazu
7642	Mikrofony a jejich stojany; reproduktory apod.
76421	Mikrofony, jejich stojany
76422	Reproduktory namontovane ve skrinich
76423	Reproduktory nenamontovane ve skrinich
76424	Sluchatka, kombinovane soupravy mikrofon/reproduktor
76425	Nizkofrekvencni elektricke zesilovace
76426	Elektricke zesilovace zvuku
7643	Přenosná zařízení pro radiotelefon,radiotelegraf apod
76431	Prenosova zarizeni
76432	Prenosova zarizeni s prijimaci aparaturou
7648	Telekomunikační zařízení, j.n.
76483	Zarizeni radarova, radiova navigacni ap. zarizeni
76484	Kamery televizní,digitální,videokamery
7649	Díly a přislušenství k telekomunikačním přístrojům
76492	Dily mikrofonu, reproduktoru, zesilovacu zvuku ap.
76493	Dily televiz., rozhlas. pris., zar. telekom., prenos.
76499	Dily pristroju pro zaznam, reprodukci zvuku
77	Elektrická zařízení, přístroje a spotřebiče, j.n., a jejich elektrické části (včetně neelektrických příbuzných spotřebičů, j.n., pro domácnost)
771	Stroje elektrické (ne točivé) a jejich díly
7711	Transformátory, elektrické
77111	Transformatory s kapalnym dielektrikem
77119	Ostatni elektricke transformatory
7712	Ostatní elektrické stroje, díly elektrických strojů
77121	Staticke menice
77123	Predradniky pro vybojky, elektronky
77125	Ostatni induktory
77129	Dily elektrickych stroju
772	Přístr. elek. ke spínání ap. obvodů elek., odpory aj.
7722	Tištěné obvody
7723	Elektrické odpory, jiné než topné odporníky
77231	Pevne uhlikove odpory, hmotove, vrstvene
77232	Ostatni pevne odpory
77233	Dratove odpory o promenne hodnote
77235	Ostatni odpory o promenne hodnote
77238	Dily elektrickych odporu
7724	Elektrické přístroje pro napětí nad 1000 V
77241	Pojistky
77242	Automaticke jistice obvodu pro napeti do 72,5 kV
77243	Ostatni automaticke jistice obvodu
77244	Izolacni prepinace, prepinaci kontakty
77245	Bleskojistky, omezovace napeti, prepetove vypinace
77249	Ostatni elektricke pristroje spinaci aj. nad 1000 V
7725	Elektrické přístroje pro napětí menší než 1000 V
77251	Pojistky
77252	Automaticke jistice obvodu
77253	Ostatni pristroje k ochrane elektrickych obvodu
77254	Rele
77255	Ostatni spinace, vypinace
77256	Konektory pro opt.vlákna,jejich svazky a kabely z opt.vláken
77257	Objimky zarovek
77258	Zastrcky
77259	Ostatni elektricke pristroje spinaci aj. do 1000 V
7726	Pulty, panely k řízení nebo rozvodu elektřiny
77261	Pulty, panely k rizeni, rozvodu elektriny do 1000 V
77262	Pulty, panely k rizeni, rozvodu elektriny nad 1000 V
7728	Díly vhodné pro skupiny 772.4, 772.5 a 772.6
77281	Pulty, panely, stoly aj. pro rizeni, rozvod elektriny
77282	Ostatni dily
773	Prostředky k rozvodu elektrické energie jn.
7731	Izolované dráty, kabely a ost. elektrické vodiče
77311	Vinuty drat
77312	Koaxialni kabel, ostatni koaxialni vodice
77313	Sestavy zapalovani a ost. instalace pro vozidla, lode
77316	Ostatní el. vodiče, pro napětí <= 1000 V
77317	Ostatní el. vodiče, pro napětí > 1000 V
77318	Kabely z optickych vlaken
7732	Elektroizolační prostředky
77322	Elektricke izolatory sklenene
77323	Elektricke izolatory keramicke
77324	Elektricke izolatory z jineho materialu
77326	Izolacni pruchodky pro elektricke stroje z keramiky
77328	Izolacni pruchodky pro elektricke stroje z plastu
77329	Izolacni pruchodky pro el. stroje z jinych materialu
774	Přístroje elektrodiagnostické pro účely medicinální
7741	Elektrodiagnostické přístroje (ne radiologické)
77411	Elektrokardiografy
77412	Ostatni elektrodiagnosticke pristroje
77413	Pristroje s ultrafialovymi, infracervenymi paprsky
7742	Přístroje na bázi rtg aj. záření, příslušenství, díly
77421	Pristroje na bazi rentgenoveho zareni
77422	Pristroje na bazi zareni alfa, beta, gama
77423	Rentgenky
77429	Generatory, panely, pulty aj., dily, prislusenstvi
775	Zařízení elektrická a mechanická pro domácnost jn.
7751	Domácí pračky
77511	Domaci pracky, do 10 kg sucheho pradla
77512	Susicky pradla, do 10 kg sucheho pradla
7752	Domácí chladničky a mrazničky
77521	Domaci chladnicky, pr. s hlubokomrazicim prostorem
77522	Domaci mraznicky
7753	Domácí myčky nádobí
7754	Strojky holící, na stříhání vlasů s elektr. motorkem
77541	Holici strojky s elektrickym motorkem
77542	Strojky na strihani vlasu s elektrickym motorkem
77549	Dily holicich strojku, strojku na strihani vlasu
7755	Vysavače
77551	Vysavače s vestavěným el. motorem
77556	Vysavače bez vestavěného el. motoru
77557	Díly vysavačů
7757	Elektromechanické domácí spotřebiče s elektr. motorem
77572	Mlynky na potraviny ap. strojky, domaci, elektromech.
77573	Ostatni elektromechanicke domaci spotrebice s motorem
77579	Dily domacich mycek nadobi
7758	Elektrotepelné spotřebiče
77581	Elektricke ohrivace vody prutokove, zasobnikove aj.
77582	Elektricke pristroje k vytapeni prostor, ohrevu pudy
